id;Плейлист;Название видео;Лайки;Дизлайки;Просмотры;Комментарии;Продолжительность(с);Дата публикации
282;новости недели;две новые матрицы, рекорд джокера, возвращение человека-паука и другие новости кино (октябрь №1);31500;1025;266179;1 645;1376;08.10.2019
283;новости недели;новый взгляд на старых героев - магнето и харви дент афроамериканцы?| новости кино (август);25766;962;503030;1 378;1518;12.08.2019
284;новости недели;четвёртая фаза киновселенной марвел | все детали анонсов комик-кона;43844;1950;1541072;3 939;1560;29.07.2019
285;новости недели;новые анонсы марвел, терминатор 6, новый росомаха и фаталити в мортал комбате! новости кино (июль);29750;1144;564170;1 918;1489;21.07.2019
286;новости недели;матрица возвращается, злодей черной вдовы, отличия мстителей и другие новости кино (июнь);28604;1238;487597;1 376;1567;30.06.2019
287;новости недели;твердо-жидкий терминатор, возвращение земо, рэмбо 5 и другие новости кино (май-июнь);32634;1547;647104;1 885;1645;04.06.2019
288;новости недели;новый железный человек, слияние disney и fox, четвертая фаза квм и другие новости кино (май);34957;1055;979339;1 786;1254;20.05.2019
289;новости недели;будущее мстителей, мистерио и паук, сюжет бонда 25 и другие новости кино (апрель_4);26534;926;3175392;1 112;814;30.04.2019
290;новости недели;тайна ника фьюри, слив мстителей, скрытый злодей форсажа и другие новости кино (апрель_3);23000;473;413579;970;924;23.04.2019
291;новости недели;шазам 2, фильм нолана, грут в аватаре, star wars celebration и другие новости кино (апрель_2);20443;2546;245029;1 275;935;16.04.2019
292;новости недели;старк из будущего, джокер из прошлого, гейркулес от марвел и другие новости кино (апрель) | 4k;33083;1219;43060;1 503;1089;04.04.2019
293;новости недели;заговор марвел, возвращение ганна, шедевр от тарантино, странные дела 3 | новости кино (март_3);27145;850;423806;1 363;1101;21.03.2019
294;новости недели;новый блэйд, сборы капитана марвел, шазам, состав отряда самоубийц и другие новости кино (март_2);36822;1476;650953;2 614;1108;12.03.2019
295;новости недели;бри уничтожает марвел, смех нового джокера, перенос мстителей и другие новости кино (март_1);61141;2721;908994;7 093;1289;04.03.2019
296;новости недели;расизм и оскар, новый бонд, съемки хищных птиц и другие новости кино (фев_4);26547;1158;33808;1 451;1111;26.02.2019
297;новости недели;мрачное сердце, терминатор 6, трейлер мстители 4/звездные войны эпизод 9 | новости кино (фев_3);24745;694;245973;1 269;1146;19.02.2019
298;новости недели;пасхалки сайта капитан марвел, еще один росомаха, детали мстители 4, аладдин | новости кино (фев_2);29506;636;754430;975;972;12.02.2019
299;новости недели;новый мститель, отряд самоубийц 2, уход аффлека, возвращение зака снайдера | новости кино (фев_1);24085;487;650953;1 130;1079;05.02.2019
300;новости недели;другой дэдпул, охотники 3, злодей пикачу, новый фильм нолана и другие новости кино (янв_4);27467;1019;245973;1 984;1216;29.01.2019
301;новости недели;спаситель тони старка, злодеи шазама, силы капитана марвел | новости кино (янв_2);27387;821;1004700;1 141;992;15.01.2019
302;новости недели;новый хищник и чужой, люди икс в киновселенной марвел, джек блэк vs pewdiepie | новости кино (янв_1);23937;840;601438;914;708;08.01.2019
303;новости недели;отец дарта вейдера, новые люди в черном, теория джокера и другие новости кино (дек_4);29928;1472;246826;1 665;1005;24.12.2018
304;новости недели;второй тони старк, сюжет человека-паука 2, сиквел венома и другие новости кино (дек_3);31198;876;246826;908;1007;18.12.2018
305;новости недели;удаленная сцена из венома, злодеи сиквела человека-паука, джокер и все новости кино (дек_2);33367;1627;774779;2 216;986;12.12.2018
306;новости недели;трейлер мстители 4, приквел венома, закрытие сорвиголовы и конкурс! | новости недели (декабрь 1);35885;1012;382415;7 232;870;04.12.2018
307;новости недели;новый пират, сериал о стражах, король лев, киану ривз в истории игрушек | новости недели (ноябрь 4);27730;563;382415;1 028;671;26.11.2018
308;новости недели;новый герой марвел, детектив пикачу, шерлок холмс 3 и другие новости кино (ноябрь №3);31192;946;246826;944;867;19.11.2018
309;новости недели;продолжение во все тяжкие, новый шрек, детский дэдпул, карнаж в bluray версии | новости ноябрь №2;21734;537;263167;850;700;12.11.2018
310;новости недели;трейлер мстители 4, ведьмак в парике, сериал о зимнем солдате, азор ахай | новости (ноябрь 1);28744;1103;525845;1 394;762;05.11.2018
311;новости недели;новый капитан америки, джек воробей не пират, пеппер поттс супергерой | новости недели (октябрь 5);25785;686;454474;1 052;777;29.10.2018
312;новости недели;мертвый джокер, любовь питера и эмджей, аффлек уходит из dc | новости недели (октябрь 4);24299;427;615720;839;1066;23.10.2018
313;новости недели;квантовые костюмы, мстители 4: аннигиляция, ганн ушел в dc | новости недели от котокраба (октябрь 3);27915;637;600700;997;1172;14.10.2018
314;новости недели;квантовый город, смерть капитана америки, джокер, алита - тест аватара | новости недели (октябрь №2);32015;804;246826;1 293;1210;07.10.2018
315;новости недели;еще один джокер, смерть мутанта, новый паук и супербонд | новости недели от котокраба (октябрь #1);27476;689;246826;1 043;1074;01.10.2018
316;новости недели;настоящее имя джокера, дэдпул в мстителях и новая цири | новости недели от котокраба (сентябрь #4);32086;859;325834;1 333;1005;23.09.2018
317;новости недели;новый джокер, трейлер капитан марвел и черный супермен | новости недели от котокраба (сентябрь №3);36044;1478;735189;1 653;716;16.09.2018
318;новости недели;первые скруллы, капитан марвел и новый ведьмак от netflix | новости второй недели сентября;37449;672;270744;1 226;543;09.09.2018
319;новости недели;аффлек не бэтмен, геймплей cyberpunk 2077, eminem и веном | еженедельные новости (сент. №1);23504;930;805092;716;601;02.09.2018
320;новости недели;название новых мстителей, костюмы паука и кое-что еще | новостной digest от cut the crap;30809;1495;446937;1 107;383;27.08.2018
321;новости недели;веном в киновселенной марвел? мстители4 и другие новости кино от котокраба;34132;819;316453;1 365;718;14.01.2018
322;новости недели;"новости и реакция на трейлер русского фильма ""викинг""";11046;390;805752;713;556;21.09.2016
323;новости недели;weekly digest #1 (ноябрь) | cut the crap tv;239;5;7314;14;261;09.11.2015
324;разное;самый честный трейлер фильма терминатор: генезис;343;86;376400;15;104;13.09.2015
325;разное;трейлер пробуждения силы из предыдущих эпизодов | cut the crap tv;359;16;12174;12;151;12.11.2015
326;разное;"я посмотрел ""звёздные войны эпизод vii: пробуждение силы"" *без спойлеров | мемуары от cutthecraptv";433;38;70409;59;151;19.12.2015
327;разное;"кайло рен в шоу snl ""боссы под прикрытием - база старкиллер"" *перевод | разное от cut the crap tv";2541;39;247626;0;0;17.01.2016
328;разное;реклама heavy bubbles с нашей озвучкой;1741;105;805752;63;72;01.04.2016
329;разное;эволюция джокера в кино | cut the crap | vokavoka;1854;115;750375;115;486;31.10.2019
330;разное;"cложный юмор рики джервейса | все отсылки вступительной речи на церемонии ""золотой глобус 2020""";37565;1310;438690;1 963;1086;21.01.2020
331;разное;диснеевские пасхалки в фильмах киновселенной марвел;23400;839;319240;1 318;862;31.03.2020
332;разное;мифы марвел, в которые мы верим | супергеройские заблуждения;31681;1222;3175409;814;890;30.06.2020
333;разное;будущее киновселенной dc угрожает marvel? | полный разбор анонсов dc fandome 2020;22003;393;402007;1 143;1532;26.08.2020
334;разное;почему блокбастеры так популярны? | как твой мозг смотрит кино;27488;723;491196;1 498;1089;12.11.2020
335;разное;новинки 2021 года (кино, сериалы и видеоигры);26926;621;355904;1 419;1183;18.01.2021
336;разное;теория гипноза подтвердилась (серия 6) | вандавижн;19994;771;208882;1 790;1069;17.02.2021
337;пересказы (истории серий);"киновселенная шьямалана | хронология фильмов ""неуязвимый"" и ""сплит""";38270;429;806495;960;466;27.10.2018
338;пересказы (истории серий);"киновселенная ""трансформеры/transformers"" | хронология событий до 2017";26931;622;554083;1 011;920;20.06.2017
339;пересказы (истории серий);киновселенная dceu от начала и до лиги справедливости | пересказ фильмов dc;20413;632;449076;692;828;16.11.2017
340;пересказы (истории серий);киновселенная хищников | пересказ событий фильмов до 2018;43067;699;248724;1 250;862;13.09.2018
341;пересказы (истории серий);"все фильмы ""парк юрского периода"" за 10 минут | пересказ событий до ""мир юрского периода 2"" 2018";20666;345;806495;678;730;05.06.2018
342;пересказы (истории серий);все звездные войны за 20 минут;39854;1039;1493932;1 703;1218;14.12.2017
343;пересказы (истории серий);"хронология киновселенной марвел/marvel | пересказ квм до ""мстители: война бесконечности"" 2018";69435;1254;603965;3 532;1284;26.04.2018
344;пересказы (истории серий);киновселенная пираты карибского моря | хронология событий до 2017;38217;557;262130;906;725;24.05.2017
345;пересказы (истории серий);"киновселенная чужих/aliens | пересказ серии ""чужой"" в хронологическом порядке";61818;676;248724;1 525;605;16.05.2017
346;пересказы (истории серий);история киновселенной марвел / marvel *mcu;25145;638;1362376;2 089;788;12.04.2016
347;пересказы (истории серий);звездные войны - полная история саги за 30 минут | пересказ от cut the crap tv;14110;450;979337;719;1759;15.12.2015
348;пересказы (истории серий);"краткая история саги ""звёздные войны"" за 5 минут | пересказ от cut the crap tv";1659;33;276944;62;328;18.12.2015
349;пересказы (истории серий);полная история серии assassins creed за 5 минут | пересказ от cut the crap tv;4797;171;723089;201;418;22.09.2015
350;пересказы (истории серий);полная история всех частей metal gear всего за 10 минут | пересказ от cut the crap tv;1717;236;543964;157;683;08.09.2015
351;пересказы (истории серий);пересказ игры престолов (1-7 сезоны);28654;1003;398678;1 098;868;10.04.2019
352;пересказы (истории серий);"полная история людей-икс/x-men до фильма ""люди-икс: тёмный феникс""";91112;2317;2128646;3 484;1648;07.06.2019
353;пересказы (истории серий);полная история людей в черном/men in black до «люди в чёрном: интернэшнл»;30732;800;444320;969;619;14.06.2019
354;пересказы (истории серий);вся история игрушек в хронологическом порядке до 2019 года;18426;405;317032;632;944;21.06.2019
355;пересказы (истории серий);"терминатор: хронология | пересказ событий до ""терминатор: темные судьбы""";15557;632;300777;878;604;27.10.2019
356;пересказы (истории серий);"киновселенная звёздные войны | полная хронология фильмов до ""скайуокер. восход"" 2019";44058;976;2128646;1 628;1714;23.11.2019
357;пересказы (истории серий);вселенная hаlf life (?) | пересказ всей истории гордона фримена;72654;1324;282807;2 951;2402;22.03.2020
358;пересказы (истории серий);хронология серии portal (?) | пересказ истории aperture science;22236;413;309378;794;601;06.04.2020
359;пересказы (истории серий);объяснение сюжета half-life: alyx за 15 минут;32985;493;470454;1 064;924;25.04.2020
360;пересказы (истории серий);полный разбор вселенной киберпанк 2077 | что показали в трейлере cyberpunk 2077;62740;1187;737982;1 970;2514;28.07.2020
361;пересказы (истории серий);обязательно посмотри это перед снайдеркатом // полная хронология киновселенной dc;42163;1008;807098;2 412;1078;17.03.2021
362;факты, которые вы не знали (наверное);топ невероятных актёрских трансформаций;3241;36;140466;230;530;19.01.2016
363;факты, которые вы не знали (наверное);"секреты и скрытые детали ""пробуждения силы"" *спойлеры | факты от cut the crap tv";10483;313;97890;449;280;06.01.2016
364;факты, которые вы не знали (наверное);как халтурят в современных блокбастерах | ляпы от cut the crap tv;8341;390;289996;176;343;23.11.2015
365;факты, которые вы не знали (наверное);теория вселенной тарантино;9343;158;289996;235;409;17.11.2015
366;факты, которые вы не знали (наверное);"едва заметные ляпы в серии ""звездные войны"" | ляпы от cut the crap tv";7488;151;207076;198;413;02.11.2015
367;факты, которые вы не знали (наверное);первые фильмы знаменитых актеров | факты от cut the crap tv;2688;51;115587;225;428;29.10.2015
368;факты, которые вы не знали (наверное);крутые альтернативные концовки, которые вы не видели (часть 2) | факты от cut the crap tv;3514;81;231942;88;627;20.10.2015
369;факты, которые вы не знали (наверное);крутые альтернативные концовки, которые вы не видели (часть 1) | факты от cut the crap tv;2948;71;170140;53;277;13.10.2015
370;факты, которые вы не знали (наверное);очевидные ляпы, попавшие в фильм | cut the crap tv;9780;544;552625;134;407;06.10.2015
371;факты, которые вы не знали (наверное);актерские ляпы, попавшие в фильм | cut the crap tv;3883;73;196174;81;307;28.09.2015
372;факты, которые вы не знали (наверное);"факты, которые вы не знали о фильме ""безумный макс"" (наверное) | cut the crap tv";2454;82;2349423;41;330;11.06.2015
373;что показали в трейлере;трейлер нас обманул, это не саб-зиро! чпвт мортал комбат/mortal kombat 2021 // теория;51792;1593;1041864;4 059;1616;07.03.2021
374;что показали в трейлере;чпвт сокол и зимний содат | киновселенная марвел 2021;20734;389;306207;1 001;1460;27.02.2021
375;что показали в трейлере;"что показали в трейлере ""локи/loki"" | рик и морти, теория обратной мультивселенной, встреча с кэпом";32465;713;724642;1 442;2005;24.12.2020
376;что показали в трейлере;что показали в трейлере дюна 2021 | введение в историю, отличия от версии линча, покадровый анализ;33444;787;535573;1 679;2094;01.11.2020
377;что показали в трейлере;что показали в трейлере бэтмен | загадочник не злодей? самый детальный разбор тизера batman;42292;1014;1070462;1 656;1894;13.09.2020
378;что показали в трейлере;что показали в трейлере снайдеркат | разбор всех отличий режиссерской версии лиги справедливости;58064;1982;14537;1 589;1765;02.09.2020
379;что показали в трейлере;полный разбор вселенной киберпанк 2077 | что показали в трейлере cyberpunk 2077;62740;1187;737983;1 970;2514;28.07.2020
380;что показали в трейлере;"что показали в трейлере ""форсаж 9: вселенная форсаж"" | покадровый разбор ""f9 the fast saga""";49920;2105;1093792;3 221;1306;22.02.2020
381;что показали в трейлере;"что показали в трейлере ""морбиус/morbius"" | киновселенная марвел 2020";38324;1161;1107157;1 231;1482;31.01.2020
382;что показали в трейлере;"что показали в трейлере ""чудо-женщина 1984/wonder woman 84"" | как вернулся стив?";22119;549;382425;1 227;1414;18.12.2019
383;что показали в трейлере;"что показали в трейлере ""half-life: alyx"" (?) | революция от valve";38076;1246;783235;1 605;1430;27.11.2019
384;что показали в трейлере;"что показали в трейлере ""соник в кино/sonic:the hedgehog"" | теория путешествий во времени";31272;798;251353;1 706;1367;21.11.2019
385;что показали в трейлере;"что показали в трейлере 2 ""человек-паук: вдали от дома/spider-man far from home"" + тв-споты";37444;1303;968489;1 978;1524;28.05.2019
386;что показали в трейлере;"что показали в трейлере ""звездные войны: скайуокер. восход"" | эпизод 9 the rise of skywalker";37539;2066;701732;2 231;1487;26.04.2019
387;что показали в трейлере;"что показали в трейлере ""джокер/joker"" | покадровый разбор";38198;1728;369350;2 039;1628;12.04.2019
388;что показали в трейлере;"что показали в трейлере ""люди в черном: интернэшнл/men in black international""";24797;800;706595;1 107;1052;15.02.2019
389;что показали в трейлере;"что показали в новом трейлере ""мстители: финал"" с суперкубка | marvel 2019";41463;956;936429;1 288;369;04.02.2019
390;что показали в трейлере;"что показали в трейлере ""человек-паук: вдали от дома"" | киновселенная марвел 2019";48155;1245;1630238;2 658;1689;21.01.2019
391;что показали в трейлере;"что показали в трейлере ""мстители: финал/avengers: endgame"" | киновселенная марвел 2019";82927;3533;1630238;4 781;1108;10.12.2018
392;что показали в трейлере;"что показали в трейлере ""покемон: детектив пикачу/pokemon detective pikachu""";38467;1120;508014;1 724;990;29.11.2018
393;что показали в трейлере;"что показали в трейлере ""годзилла 2: король монстров"" | киновселенная monsterverse 2019";21342;438;491216;1 058;788;09.11.2018
394;что показали в трейлере;"что показали в трейлере ""стекло/glass"" | киновселенная шьямалана 2019";33375;882;411022;1 215;1147;03.11.2018
395;что показали в трейлере;"что показали в трейлере ""капитан марвел/captain marvel""";35912;903;875224;1 568;1781;29.09.2018
396;что показали в трейлере;"что показали в трейлере 2 ""веном/venom"" | marvel 2018";49281;1658;1012667;2 020;1289;15.08.2018
397;что показали в трейлере;"что показали в трейлере ""шазам!/shazam!"" | киновселенная dceu 2018";48812;1077;251353;1 728;1426;28.07.2018
398;что показали в трейлере;"что показали в трейлере ""хищник/the predator"" | совершенный хищник 2018";30002;927;317032;1 176;1020;02.07.2018
399;что показали в трейлере;"что показали в трейлере ""бамблби/bumblebee"" | трансформеры 2018";34324;1218;317032;1 588;956;23.06.2018
400;что показали в трейлере;"что показали в трейлере ""веном/venom"" | марвел 2018";34470;2815;740332;1 584;700;26.05.2018
401;что показали в трейлере;"что показали в трейлере ""дэдпул 2/deadpool 2"" | марвел 2018";33583;737;661189;1 482;1107;09.04.2018
402;что показали в трейлере;"что показали в трейлере ""фантастические твари 2: преступления гриндевальда"" | гарри поттер 2018";32642;1308;615470;1 578;1036;04.04.2018
